{"artifact_type":"verdiwm-unified-irg-asset","asset_id":"acwm-phys:stack_cube:joint-autoregressive-r1","backbone_family":"acwm_phys","backbone_instance_ref":"configs/backbones/acwm_phys_g1_long_horizon_ladder_v1.json","capability_class":"latent_dit_action_conditioned","checkpoint_steps":[100000],"claim_boundary":"This asset is a measured local routing chart. Unsupported paths are retained as raw finite-dose evidence but masked from J, G, and r. Cross-baseline-group covariance is unobserved and cannot license transfer.","coordinate_names":["psnr:action_conditioning_amplification","psnr:action_conditioning_attenuation","psnr:self_rollout_temporal_mix","psnr:motion_region_scale","psnr:action_embedding_temporal_mix","psnr:motion_region_event_alignment","psnr:action_temporal_alignment","ssim:action_conditioning_amplification","ssim:action_conditioning_attenuation","ssim:self_rollout_temporal_mix","ssim:motion_region_scale","ssim:action_embedding_temporal_mix","ssim:motion_region_event_alignment","ssim:action_temporal_alignment","negative_mse:action_conditioning_amplification","negative_mse:action_conditioning_attenuation","negative_mse:self_rollout_temporal_mix","negative_mse:motion_region_scale","negative_mse:action_embedding_temporal_mix","negative_mse:motion_region_event_alignment","negative_mse:action_temporal_alignment","negative_masked_mse:action_conditioning_amplification","negative_masked_mse:action_conditioning_attenuation","negative_masked_mse:self_rollout_temporal_mix","negative_masked_mse:motion_region_scale","negative_masked_mse:action_embedding_temporal_mix","negative_masked_mse:motion_region_event_alignment","negative_masked_mse:action_temporal_alignment"],"covariance_contract":{"baseline_absolute_tolerance":0.0001,"cross_group_entries":"unmeasured_zero_filled","estimator":"paired-seed sample covariance within baseline-compatible source groups","joint_baseline_group_count":1,"observed_blocks":[{"coordinate_indices":[0,1,2,3,4,5,6,7,8,9,10,11,12,13,14,15,16,17,18,19,20,21,22,23,24,25,26,27],"group_id":"baseline-group-1","maximum_baseline_deviation":0.0,"path_names":["action_conditioning_amplification","action_conditioning_attenuation","self_rollout_temporal_mix","motion_region_scale","action_embedding_temporal_mix","motion_region_event_alignment","action_temporal_alignment"],"repeat_count":3,"source_ids":["acwm_phys_joint_irg_autoregressive_pilot_v1"]}]},"dimensions":{"outcome_count":4,"probe_path_count":7,"response_coordinate_count":28},"environment":"stack_cube","goal_schema":"acwm_phys_goal_oriented_pixel_metrics_v1","jacobian":[[-3.0312276625953416,0.0,-0.7964245940437564,0.0,0.9118908604612367,0.058432208351568704,-0.24084039770739216],[-0.050858259201049805,0.0,-0.022971828778584797,0.0,0.011042356491088867,0.0030829509099324546,-0.004501740137736003],[-0.00691637396812439,0.0,-0.002132731800278028,0.0,0.0017067665855089824,0.00018241815268993378,-0.0005200070639451345],[-0.013507679104804993,0.0,-0.00634392723441124,0.0,0.0031701475381851196,0.000618534783522288,-0.0005758305390675863]],"locality_residuals":{"action_conditioning_amplification":0.3761073325052793,"action_conditioning_attenuation":3.357497551749776,"action_embedding_temporal_mix":0.48213049493564114,"action_temporal_alignment":0.06371202343380958,"motion_region_event_alignment":0.1158909457714953,"motion_region_scale":0.9063231085850553,"self_rollout_temporal_mix":0.38969824922086194},"locality_threshold":0.5,"metric_contract":"G=J_supported^T W J_supported with ridge only on supported path diagonals","outcome_names":["psnr","ssim","negative_mse","negative_masked_mse"],"outcome_weights":[1.0,4.0,1.0,2.0],"probe_path_names":["action_conditioning_amplification","action_conditioning_attenuation","self_rollout_temporal_mix","motion_region_scale","action_embedding_temporal_mix","motion_region_event_alignment","action_temporal_alignment"],"raw_jacobian":[[-3.0312276625953416,0.4047463712062438,-0.7964245940437564,0.027272922419072643,0.9118908604612367,0.058432208351568704,-0.24084039770739216],[-0.050858259201049805,0.002353191375732422,-0.022971828778584797,0.0029389063517252603,0.011042356491088867,0.0030829509099324546,-0.004501740137736003],[-0.00691637396812439,0.0009166014691193899,-0.002132731800278028,0.00012476307650407156,0.0017067665855089824,0.00018241815268993378,-0.0005200070639451345],[-0.013507679104804993,-0.0014909232656160991,-0.00634392723441124,0.0006627167264620463,0.0031701475381851196,0.000618534783522288,-0.0005758305390675863]],"raw_repair_metric":[[9.199101143617524,-1.227323175335652,2.419003623763471,-0.08328707395837567,-2.766492628919729,-0.17776647201863996,0.730977031299835],[-1.227323175335652,0.1638480609058469,-0.32254923106376554,0.01106441785608015,0.36918056735139465,0.023677566214784902,-0.09752041043715044],[2.419003623763471,-0.32254923106376554,0.6364889930379356,-0.021999548919589468,-0.7273108232915355,-0.046828368825533734,0.19223328387772567],[-0.08328707395837567,0.01106441785608015,-0.021999548919589468,0.0007802549321979233,0.025004153259587308,0.0016307016869362698,-0.00662217035553154],[-2.766492628919729,0.36918056735139465,-0.7273108232915355,0.025004153259587308,0.8320566886632449,0.05342420196258038,-0.21982353524315743],[-0.17776647201863996,0.023677566214784902,-0.046828368825533734,0.0016307016869362698,0.05342420196258038,0.0034541397650326338,-0.014129158074892305],[0.730977031299835,-0.09752041043715044,0.19223328387772567,-0.00662217035553154,-0.21982353524315743,-0.014129158074892305,0.05808709339389164]],"raw_response_coordinate":[-3.0312276625953416,0.4047463712062438,-0.7964245940437564,0.027272922419072643,0.9118908604612367,0.058432208351568704,-0.24084039770739216,-0.10171651840209961,0.004706382751464844,-0.045943657557169594,0.0058778127034505205,0.022084712982177734,0.006165901819864909,-0.009003480275472006,-0.00691637396812439,0.0009166014691193899,-0.002132731800278028,0.00012476307650407156,0.0017067665855089824,0.00018241815268993378,-0.0005200070639451345,-0.01910274298619889,-0.0021084839026918717,-0.008971667933612417,0.0009372229825741265,0.004483265643225076,0.0008747402796567261,-0.000814347357977991],"raw_response_covariance":[[4.616089183262851,-0.945456161780876,-2.2662439702699295,0.3336087174602363,-3.6501227293123066,0.028087522857319108,0.5267103216243713,0.21186488100290074,-0.09784286837756612,-0.11617567783239864,0.01877358205803247,-0.18131552104013873,0.0017002145290699938,0.027359507160016543,0.009742643551595312,-0.0021928714071143603,-0.0057931855343019145,0.0007313810009030007,-0.007938598997346582,-2.159222029173675e-05,0.0011292870270499433,0.0339420129932102,-0.006547346669326199,-0.02000095614249955,0.002588332253351151,-0.02626288349438897,-0.00019719643081681708,0.003792611173247292],[-0.945456161780876,0.32054272288495267,0.2972013589872458,0.01966759761075606,0.3675516258083907,0.10881809480722593,-0.09772970023828337,-0.032747621480433836,0.008762205921844297,0.010584504859739777,0.0023581321434886383,0.021934915718553008,0.005913797386764085,-0.002896322178597,-0.0023471607816206576,0.0007933531925595867,0.00081523889866246,4.3351611630836377e-05,0.0009288658179486878,0.0002695548402080878,-0.00024060813301857978,-0.0071804964909981134,0.0015565959456590155,0.0024301522392416006,0.00031310975915836665,0.0024006115542444806,0.001102203332733514,-0.000573300447762257],[-2.2662439702699295,0.2972013589872458,1.3322858684263572,-0.279565441970986,2.2920715018657467,-0.1645369077847595,-0.2719402850793721,-0.1180215023830718,0.06287418243280853,0.07441738503120401,-0.017378813223124047,0.10901760176814687,-0.009074023028739515,-0.016994263503890928,-0.004320351262939709,0.0006236755306894333,0.003332683224263715,-0.0006132077174328309,0.004814624746355402,-0.00033824921668755185,-0.0005421672398133208,-0.016362896956534607,0.002930727768582564,0.012011932015682788,-0.002380234169701628,0.01681258752992816,-0.001300276827945596,-0.0021297091952524596],[0.3336087174602363,0.01966759761075606,-0.279565441970986,0.08513138658766074,-0.5273485031387914,0.08147912120752232,0.04510420456491521,0.022694145787028577,-0.014891732653409677,-0.017556810041811588,0.005658456054091444,-0.02364544040010034,0.004465282162512459,0.003854731806766448,0.00046022540927427336,8.021495952252644e-05,-0.0006761615485877678,0.0001867983137612186,-0.0010571325319273428,0.00018229558508375544,7.515830472330567e-05,0.002294512339634707,-0.0003236853784149546,-0.002601047990437657,0.0007718097935462444,-0.0039634741633544635,0.0007220635046906875,0.00041520746495863405],[-3.6501227293123066,0.3675516258083907,2.2920715018657467,-0.5273485031387914,4.024573924381378,-0.3653516378540515,-0.44688940110517195,-0.19941489568843854,0.11114518337784114,0.13142977050787102,-0.03342396580943694,0.18890259441982127,-0.020099310718003634,-0.029742898553886454,-0.006650554445823993,0.0007030611228624493,0.005692970250554666,-0.0011568228654051166,0.008365183449785913,-0.0007770019215223494,-0.0008650870062287114,-0.02615469207024449,0.004531565233855638,0.02080642011463113,-0.004572230213871596,0.02968771257290266,-0.00302421922270006,-0.0036084310440743536],[0.028087522857319108,0.10881809480722593,-0.1645369077847595,0.08147912120752232,-0.3653516378540515,0.10361327138288601,0.012368825040040712,0.010901088646102796,-0.010777644043641121,-0.01263405988069286,0.005714982715411229,-0.014828362939042225,0.005664130480545353,0.002610885163227118,-0.0002582540545755708,0.00029743725173087085,-0.00037049111744779777,0.00017884027958289648,-0.0006776918667163682,0.00023924805277053107,-1.5346035677453869e-06,1.5320244185854787e-07,0.00015480545556076223,-0.0016262338891000656,0.0007770884437630209,-0.002848982503840103,0.0009574776305562936,0.00020680410064469697],[0.5267103216243713,-0.09772970023828337,-0.2719402850793721,0.04510420456491521,-0.44688940110517195,0.012368825040040712,0.06091114095727459,0.02502597270390175,-0.012066228603552196,-0.01431263747112187,0.002638